qtype,Question,Answer
treatment,What are the treatments for Heart Block ?,"Treatment depends on the type of heart block you have. If you have first-degree heart block, you may not need treatment.
                
If you have second-degree heart block, you may need a pacemaker. A pacemaker is a small device that's placed under the skin of your chest or abdomen. This device uses electrical pulses to prompt the heart to beat at a normal rate.
                
If you have third-degree heart block, you will need a pacemaker. In an emergency, a temporary pacemaker might be used until you can get a long-term device. Most people who have third-degree heart block need pacemakers for the rest of their lives.
                
Some people who have third-degree congenital heart block don't need pacemakers for many years. Others may need pacemakers at a young age or during infancy.
                
If a pregnant woman has an autoimmune disease, such as lupus, her fetus is at risk for heart block. If heart block is detected in a fetus, the mother might be given medicine to reduce the fetus' risk of developing serious heart block.
                
Sometimes acquired heart block goes away if the factor causing it is treated or resolved. For example, heart block that occurs after a heart attack or surgery may go away during recovery.
                
Also, if a medicine is causing heart block, the condition may go away if the medicine is stopped or the dosage is lowered. (Always talk with your doctor before you change the way you take your medicines.)"
information,What is (are) Patent Ductus Arteriosus ?,"Patent ductus arteriosus (PDA) is a heart problem that occurs soon after birth in some babies. In PDA, abnormal blood flow occurs between two of the major arteries connected to the heart.
                
Before birth, the two major arteriesthe aorta and the pulmonary (PULL-mun-ary) arteryare connected by a blood vessel called the ductus arteriosus. This vessel is an essential part of fetal blood circulation.
                
Within minutes or up to a few days after birth, the vessel is supposed to close as part of the normal changes occurring in the baby's circulation.
                
In some babies, however, the ductus arteriosus remains open (patent). This opening allows oxygen-rich blood from the aorta to mix with oxygen-poor blood from the pulmonary artery. This can put strain on the heart and increase blood pressure in the lung arteries.
                
Normal Heart and Heart With Patent Ductus Arteriosus
                

                
Go to the ""How the Heart Works"" section of this article for more details about how a normal heart works compared with a heart that has PDA.
                
Overview
                
PDA is a type of congenital (kon-JEN-ih-tal) heart defect. A congenital heart defect is any type of heart problem that's present at birth.
                
If your baby has a PDA but an otherwise normal heart, the PDA may shrink and go away. However, some children need treatment to close their PDAs.
                
Some children who have PDAs are given medicine to keep the ductus arteriosus open. For example, this may be done if a child is born with another heart defect that decreases blood flow to the lungs or the rest of the body.
                
Keeping the PDA open helps maintain blood flow and oxygen levels until doctors can do surgery to correct the other heart defect.
                
Outlook
                
PDA is a fairly common congenital heart defect in the United States. Although the condition can affect full-term infants, it's more common in premature infants.
                
On average, PDA occurs in about 8 out of every 1,000 premature babies, compared with 2out of every 1,000 full-term babies. Premature babies also are more vulnerable to the effects of PDA.
                
PDA is twice as common in girls as it is in boys.
                
Doctors treat the condition with medicines, catheter-based procedures, and surgery. Most children who have PDAs live healthy, normal lives after treatment."
symptoms,What are the symptoms of Patent Ductus Arteriosus ?,"A heart murmur may be the only sign that a baby has patent ductus arteriosus (PDA). A heart murmur is an extra or unusual sound heard during the heartbeat. Heart murmurs also have other causes besides PDA, and most murmurs are harmless.
                
Some infants may develop signs or symptoms of volume overload on the heart and excess blood flow in the lungs. Signs and symptoms may include:
                
Fast breathing, working hard to breathe, or shortness of breath. Premature infants may need increased oxygen or help breathing from a ventilator.
                
Poor feeding and poor weight gain.
                
Tiring easily.
                
Sweating with exertion, such as while feeding."
information,What is (are) Heart Valve Disease ?,"Heart valve disease occurs if one or more of your heart valves don't work well. The heart has four valves: the tricuspid, pulmonary, mitral,and aortic valves.
                
These valves have tissue flaps that open and close with each heartbeat. The flaps make sure blood flows in the right direction through your heart's four chambers and to the rest of your body.
                
Healthy Heart Cross-Section
                

                
Birth defects, age-related changes, infections, or other conditions can cause one or more of your heart valves to not open fully or to let blood leak back into the heart chambers. This can make your heart work harder and affect its ability to pump blood.
                
Overview
                
How the Heart Valves Work
                
At the start of each heartbeat, blood returning from the body and lungs fills the atria (the heart's two upper chambers). The mitral and tricuspid valves are located at the bottom of these chambers. As the blood builds up in the atria, these valves open to allow blood to flow into the ventricles (the heart's two lower chambers).
                
After a brief delay, as the ventricles begin to contract, the mitral and tricuspid valves shut tightly. This prevents blood from flowing back into the atria.
                
As the ventricles contract, they pump blood through the pulmonary and aortic valves. The pulmonary valve opens to allow blood to flow from the right ventricle into the pulmonary artery. This artery carries blood to the lungs to get oxygen.
                
At the same time, the aortic valve opens to allow blood to flow from the left ventricle into the aorta. The aorta carries oxygen-rich blood to the body. As the ventricles relax, the pulmonary and aortic valves shut tightly. This prevents blood from flowing back into the ventricles.
                
For more information about how the heart pumps blood and detailed animations, go to the Health Topics How the Heart Works article.
                
Heart Valve Problems
                
Heart valves can have three basic kinds of problems: regurgitation, stenosis, and atresia.
                
Regurgitation, or backflow, occurs if a valve doesn't close tightly. Blood leaks back into the chambers rather than flowing forward through the heart or into an artery.
                
In the United States, backflow most often is due to prolapse. ""Prolapse"" is when the flaps of the valve flop or bulge back into an upper heart chamber during a heartbeat. Prolapse mainly affects the mitral valve.
                
Stenosis occurs if the flaps of a valve thicken, stiffen, or fuse together. This prevents the heart valve from fully opening. As a result, not enough blood flows through the valve. Some valves can have both stenosis and backflow problems.
                
Atresia occurs if a heart valve lacks an opening for blood to pass through.
                
Some people are born with heart valve disease, while others acquire it later in life. Heart valve disease that develops before birth is called congenitalheart valve disease. Congenital heart valve disease can occur alone or with other congenital heart defects.
                
Congenital heart valve disease often involves pulmonary or aortic valves that don't form properly. These valves may not have enough tissue flaps, they may be the wrong size or shape, or they may lack an opening through which blood can flow properly.
                
Acquired heart valve disease usually involves aortic or mitral valves. Although the valves are normal at first, problems develop over time.
                
Both congenital and acquired heart valve disease can cause stenosis or backflow.
                
Outlook
                
Many people have heart valve defects or disease but don't have symptoms. For some people, the condition mostly stays the same throughout their lives and doesn't cause any problems.
                
For other people, heart valve disease slowly worsens until symptoms develop. If not treated, advanced heart valve disease can cause heart failure, stroke, blood clots, or death due to sudden cardiac arrest (SCA).
                
Currently, no medicines can cure heart valve disease. However, lifestyle changes and medicines can relieve many of its symptoms and complications. 
                
These treatments also can lower your risk of developing a life-threatening condition, such as stroke or SCA. Eventually, you may need to have your faulty heart valve repaired or replaced.
                
Some types of congenital heart valve disease are so severe that the valve is repaired or replaced during infancy, childhood, or even before birth. Other types may not cause problems until middle-age or older, if at all."
causes,What causes Heart Valve Disease ?,"Heart conditions and other disorders, age-related changes, rheumatic fever, or infections can cause acquired heart valve disease. These factors change the shape or flexibility of once-normal heart valves.
                
The cause of congenital heart valve disease isnt known. It occurs before birth as the heart is forming. Congenital heart valve disease can occur alone or with other types of congenital heartdefects.
                
Heart Conditions and Other Disorders
                
Certain conditions can stretch and distort the heart valves. These conditions include:
                
Advanced high blood pressure and heart failure, thiscan enlarge the heart or the main arteries.
                
Atherosclerosis in the aorta. Atherosclerosis is a condition in which a waxy substance called plaque builds up inside the arteries. The aorta is the main artery that carries oxygen-rich blood to the body.
                
Damage and scar tissue due to a heart attack or injury to the heart.
                
Rheumatic Fever
                
Untreated strep throat or other infections with strep bacteria that progress to rheumatic fever can cause heart valve disease.
                
When the body tries to fight the strep infection, one or more heart valves may be damaged or scarred in the process. The aortic and mitral valves most often are affected. Symptoms of heart valve damage often dont appear until many years after recovery from rheumatic fever.
                
Today, most people who have strep infections are treated with antibiotics before rheumatic fever occurs. If you have strep throat, take all of the antibiotics your doctor prescribes, even if you feel better before the medicine is gone.
                
Heart valve disease caused by rheumatic fever mainly affects older adults who had strep infections before antibiotics were available. It also affects people from developing countries, where rheumatic fever is more common.
                
Infections
                
Common germs that enter the bloodstream and get carried to the heart can sometimes infect the inner surface of the heart, including the heart valves. This rare but serious infection is called infective endocarditis.
                
The germs can enter the bloodstream through needles, syringes, or other medical devices and through breaks in the skin or gums. Often, the bodys defenses fight off the germs and no infection occurs. Sometimes these defenses fail, which leads to infective endocarditis.
                
Infective endocarditis can develop in people who already have abnormal blood flow through a heart valve as the result of congenital or acquired heart valve disease. The abnormal blood flow causes blood clots to form on the surface of the valve. The blood clots make it easier for germs to attach to and infect the valve.
                
Infective endocarditis can worsen existing heart valve disease.
                
Other Conditions and Factors Linked to Heart Valve Disease
                
Many other conditions and factors are linked to heart valve disease. However, the role they play in causing heart valve disease often isnt clear.
                
Autoimmune disorders. Autoimmune disorders, such as lupus, can affect the aortic and mitral valves.
                
Carcinoid syndrome. Tumors in the digestive tract that spread to the liver or lymph nodes can affect the tricuspid and pulmonary valves.
                
Diet medicines. The use of fenfluramine and phentermine (fen-phen) sometimes has been linked to heart valve problems. These problems typically stabilize or improve after the medicine is stopped.
                
Marfan syndrome. Congenital disorders, such as Marfan syndrome and other connective tissue disorders, can affect the heart valves.
                
Metabolic disorders. Relatively uncommon diseases (such as Fabry disease) and other metabolic disorders (such as high blood cholesterol) can affect the heart valves.
                
Radiation therapy. Radiation therapy to the chest area can cause heart valve disease. This therapy is used to treat cancer. Heart valve disease due to radiation therapy may not cause symptoms until years after the therapy."
susceptibility,Who is at risk for Heart Valve Disease? ?,"Older age is a risk factor for heart valve disease. As you age, your heart valves thicken and become stiffer. Also, people are living longer now than in the past. As a result, heart valve disease has become an increasing problem.
                
People who have a history of infective endocarditis (IE), rheumatic fever, heart attack, or heart failureor previous heart valve diseasealso are at higher risk for heart valve disease. In addition, having risk factors for IE, such as intravenous drug use, increases the risk of heart valve disease.
                
You're also at higher risk for heart valve disease if you have risk factors for coronary heart disease. These risk factors include high blood cholesterol, high blood pressure, smoking, insulin resistance, diabetes, overweight or obesity, lack of physical activity, and a family history of early heart disease.
                
Some people are born with an aortic valve that has two flaps instead of three. Sometimes an aortic valve may have three flaps, but two flaps are fused together and act as one flap. This is called a bicuspid or bicommissural aortic valve. People who have this congenital condition are more likely to develop aortic heart valve disease."
symptoms,What are the symptoms of Heart Valve Disease ?,"Major Signs and Symptoms
                
The main sign of heart valve disease is an unusual heartbeat sound called a heart murmur. Your doctor can hear a heart murmur with a stethoscope.
                
However, many people have heart murmurs without having heart valve disease or any other heart problems. Others may have heart murmurs due to heart valve disease, but have no other signs or symptoms.
                
Heart valve disease often worsens over time, so signs and symptoms may occur years after a heart murmur is first heard. Many people who have heart valve disease don't have any symptoms until they're middle-aged or older.
                
Other common signs and symptoms of heart valve disease relate to heart failure, which heart valve disease can cause. These signs and symptoms include:
                
Unusual fatigue (tiredness)
                
Shortness of breath, especially when you exert yourself or when you're lying down
                
Swelling in your ankles, feet, legs, abdomen, and veins in the neck
                
Other Signs and Symptoms
                
Heart valve disease can cause chest pain that may happen only when you exert yourself. You also may notice a fluttering, racing, or irregular heartbeat. Some types of heart valve disease, such as aortic or mitral valve stenosis, can cause dizziness or fainting."
exams and tests,How to diagnose Heart Valve Disease ?,"Your primary care doctor may detect a heart murmur or other signs of heart valve disease. However, a cardiologist usually will diagnose the condition. A cardiologist is a doctor who specializes in diagnosing and treating heart problems.
                
To diagnose heart valve disease, your doctor will ask about your signs and symptoms. He or she also will do a physical exam and look at the results from tests and procedures.
                
Physical Exam
                
Your doctor will listen to your heart with a stethoscope. He or she will want to find out whether you have a heart murmur that's likely caused by a heart valve problem.
                
Your doctor also will listen to your lungs as you breathe to check for fluid buildup. He or she will check for swollen ankles and other signs that your body is retaining water.
                
Tests and Procedures
                
Echocardiography (echo) is the main test for diagnosing heart valve disease. But an EKG (electrocardiogram) or chest x ray commonly is used to reveal certain signs of the condition. If these signs are present, echo usually is done to confirm the diagnosis.
                
Your doctor also may recommend other tests and procedures if you're diagnosed with heart valve disease. For example, you may have cardiac catheterization, (KATH-eh-ter-ih-ZA-shun), stress testing, or cardiac MRI (magnetic resonance imaging). These tests and procedures help your doctor assess how severe your condition is so he or she can plan your treatment.
                
EKG
                
This simple test detects and records the heart's electrical activity. An EKG can detect an irregular heartbeat and signs of a previous heart attack. It also can show whether your heart chambers are enlarged.
                
An EKG usually is done in a doctor's office.
                
Chest X Ray
                
This test can show whether certain sections of your heart are enlarged, whether you have fluid in your lungs, or whether calcium deposits are present in your heart.
                
A chest x ray helps your doctor learn which type of valve defect you have, how severe it is, and whether you have any other heart problems.
                
Echocardiography
                
Echo uses sound waves to create a moving picture of your heart as it beats. A device called a transducer is placed on the surface of your chest.
                
The transducer sends sound waves through your chest wall to your heart. Echoes from the sound waves are converted into pictures of your heart on a computer screen.
                
Echo can show:
                
The size and shape of your heart valves and chambers
                
How well your heart is pumping blood
                
Whether a valve is narrow or has backflow
                
Your doctor may recommend transesophageal (tranz-ih-sof-uh-JEE-ul) echo, or TEE, to get a better image of your heart.
                
During TEE, the transducer is attached to the end of a flexible tube. The tube is guided down your throat and into your esophagus (the passage leading from your mouth to your stomach). From there, your doctor can get detailed pictures of your heart.
                
You'll likely be given medicine to help you relax during this procedure.
                
Cardiac Catheterization
                
For this procedure, a long, thin, flexible tube called a catheter is put into a blood vessel in your arm, groin (upper thigh), or neck and threaded to your heart. Your doctor uses x-ray images to guide the catheter.
                
Through the catheter, your doctor does diagnostic tests and imaging that show whether backflow is occurring through a valve and how fully the valve opens. You'll be given medicine to help you relax, but you will be awake during the procedure.
                
Your doctor may recommend cardiac catheterization if your signs and symptoms of heart valve disease aren't in line with your echo results.
                
The procedure also can help your doctor assess whether your symptoms are due to specific valve problems or coronary heart disease. All of this information helps your doctor decide the best way to treat you.
                
Stress Test
                
During stress testing, you exercise to make your heart work hard and beat fast while heart tests and imaging are done. If you can't exercise, you may be given medicine to raise your heart rate.
                
A stress test can show whether you have signs and symptoms of heart valve disease when your heart is working hard. It can help your doctor assess the severity of your heart valve disease.
                
Cardiac MRI
                
Cardiac MRI uses a powerful magnet and radio waves to make detailed images of your heart. A cardiac MRI image can confirm information about valve defects or provide more detailed information.
                
This information can help your doctor plan your treatment. An MRI also may be done before heart valve surgery to help your surgeon plan for the surgery."
