qtype,Question,Answer
information,What is (are) Holes in the Heart ?,"Holes in the heart are simple congenital (kon-JEN-ih-tal) heart defects. Congenital heart defects are problems with the heart's structure that are present at birth. These defects change the normal flow of blood through the heart.
                
The heart has two sides, separated by an inner wall called the septum. With each heartbeat, the right side of the heart receives oxygen-poor blood from the body and pumps it to the lungs. The left side of the heart receives oxygen-rich blood from the lungs and pumps it to the body.
                
The septum prevents mixing of blood between the two sides of the heart. However, some babies are born with holes in the upper or lower septum.
                
A hole in the septum between the heart's two upper chambers is called an atrial septal defect (ASD). A hole in the septum between the heart's two lower chambers is called a ventricular septal defect (VSD).
                
ASDs and VSDs allow blood to pass from the left side of the heart to the right side. Thus, oxygen-rich blood mixes with oxygen-poor blood. As a result, some oxygen-rich blood is pumped to the lungs instead of the body.
                
Over the past few decades, the diagnosis and treatment of ASDs and VSDs have greatly improved. Children who have simple congenital heart defects can survive to adulthood. They can live normal, active lives because their heart defects close on their own or have been repaired."
causes,What causes Holes in the Heart ?,"Mothers of children who are born with atrial septal defects (ASDs), ventricular septal defects (VSDs), or other heart defects may think they did something wrong during their pregnancies. However, most of the time, doctors don't know why congenital heart defects occur.
                
Heredity may play a role in some heart defects. For example, a parent who has a congenital heart defect is slightly more likely than other people to have a child who has the problem. Very rarely, more than one child in a family is born with a heart defect.
                
Children who have genetic disorders, such as Down syndrome, often have congenital heart defects. Half of all babies who have Down syndrome have congenital heart defects.
                
Smoking during pregnancy also has been linked to several congenital heart defects, including septal defects.
                
Scientists continue to search for the causes of congenital heart defects."
symptoms,What are the symptoms of Holes in the Heart ?,"Atrial Septal Defect
                
Many babies who are born with atrial septal defects (ASDs) have no signs or symptoms. However, as they grow, these children may be small for their age. 
                
When signs and symptoms do occur, a heart murmur is the most common. A heart murmur is an extra or unusual sound heard during a heartbeat.
                
Often, a heart murmur is the only sign of an ASD. However, not all murmurs are signs of congenital heart defects. Many healthy children have heart murmurs. Doctors can listen to heart murmurs and tell whether they're harmless or signs of heart problems.
                
If a large ASD isn't repaired, the extra blood flow to the right side of the heart can damage the heart and lungs and cause heart failure. This generally doesn't occur until adulthood. Signs and symptoms of heart failure include:
                
Fatigue (tiredness)
                
Tiring easily during physical activity
                
Shortness of breath
                
A buildup of blood and fluid in the lungs
                
Swelling in the ankles, feet, legs, abdomen, and veins in the neck
                
Ventricular Septal Defect
                
Babies born with ventricular septal defects (VSDs) usually have heart murmurs. Murmurs may be the first and only sign of a VSD. Heart murmurs often are present right after birth in many infants. However, the murmurs may not be heard until the babies are 6 to 8 weeks old.
                
Most newborns who have VSDs don't have heart-related symptoms. However, babies who have medium or large VSDs can develop heart failure. Signs and symptoms of heart failure usually occur during the baby's first 2 months of life.
                
The signs and symptoms of heart failure due to VSD are similar to those listed above for ASD, but they occur in infancy.
                
A major sign of heart failure in infancy is poor feeding and growth. VSD signs and symptoms are rare after infancy. This is because the defects either decrease in size on their own or they're repaired."
exams and tests,How to diagnose Holes in the Heart ?,"Doctors usually diagnose holes in the heart based on a physical exam and the results from tests and procedures. The exam findings for an atrial septal defect (ASD) often aren't obvious. Thus, the diagnosis sometimes isn't made until later in childhood or even in adulthood.
                
Ventricular septal defects (VSDs) cause a very distinct heart murmur. Because of this, a diagnosis usually is made in infancy.
                
Specialists Involved
                
Doctors who specialize in diagnosing and treating heart problems are called cardiologists. Pediatric cardiologists take care of babies and children who have heart problems. Cardiac surgeons repair heart defects using surgery.
                
Physical Exam
                
During a physical exam, your child's doctor will listen to your child's heart and lungs with a stethoscope. The doctor also will look for signs of a heart defect, such as a heart murmur or signs of heart failure.
                
Diagnostic Tests and Procedures
                
Your child's doctor may recommend several tests to diagnose an ASD or VSD. These tests also will help the doctor figure out the location and size of the defect.
                
Echocardiography
                
Echocardiography (echo) is a painless test that uses sound waves to create a moving picture of the heart. The sound waves (called ultrasound) bounce off the structures of the heart. A computer converts the sound waves into pictures on a screen.
                
Echo allows the doctor to clearly see any problem with the way the heart is formed or the way it's working.
                
Echo is an important test for both diagnosing a hole in the heart and following the problem over time. Echo can show problems with the heart's structure and how the heart is reacting to the problems. This test will help your child's cardiologist decide whether and when treatment is needed.
                
EKG (Electrocardiogram)
                
An EKG is a simple, painless test that records the heart's electrical activity. The test shows how fast the heart is beating and its rhythm (steady or irregular). It also records the strength and timing of electrical signals as they pass through the heart.
                
An EKG can detect whether one of the heart's chambers is enlarged, which can help diagnose a heart problem.
                
Chest X Ray
                
A chest x ray is a painless test that creates pictures of the structures in the chest, such as the heart, lungs, and blood vessels.
                
This test can show whether the heart is enlarged. A chest x ray also can show whether the lungs have extra blood flow or extra fluid, a sign of heart failure.
                
Pulse Oximetry
                
Pulse oximetry shows the level of oxygen in the blood. A small sensor is attached to a finger or ear. The sensor uses light to estimate how much oxygen is in the blood.
                
Cardiac Catheterization
                
During cardiac catheterization (KATH-e-ter-i-ZA-shun), a thin, flexible tube called a catheter is put into a vein in the arm, groin (upper thigh), or neck. The tube is threaded to the heart.
                
Special dye is injected through the catheter into a blood vessel or one of the heart's chambers. The dye allows the doctor to see the flow of blood through the heart and blood vessels on an x-ray image.
                
The doctor also can use cardiac catheterization to measure the pressure inside the heart chambers and blood vessels. This can help the doctor figure out whether blood is mixing between the two sides of the heart.
                
Doctors also use cardiac catheterization to repair some heart defects. For more information, go to ""How Are Holes in the Heart Treated?"""
treatment,What are the treatments for Holes in the Heart ?,"Many holes in the heart don't need treatment, but some do. Those that do often are repaired during infancy or early childhood. Sometimes adults are treated for holes in the heart if problems develop.
                
The treatment your child receives depends on the type, location, and size of the hole. Other factors include your child's age, size, and general health.
                
Treating an Atrial Septal Defect
                
If a child has an atrial septal defect (ASD), routine checkups are done to see whether it closes on its own. About half of all ASDs close on their own over time, and about 20 percent close within the first year of life.
                
Your child's doctor will let you know how often your child should have checkups. For an ASD, frequent checkups aren't needed.
                
If an ASD requires treatment, catheter or surgical procedures are used to close the hole. Doctors often decide to close ASDs in children who still have medium- or large-sized holes by the time they're 2 to 5 years old.
                
Catheter Procedure
                
Until the early 1990s, surgery was the usual method for closing all ASDs. Now, thanks to medical advances, doctors can use catheter procedures to close secundum ASDs. These are the most common type of ASD.
                
Before a catheter procedure, your child is given medicine so he or she will sleep and not feel any pain. Then, the doctor inserts a catheter (a thin, flexible tube) into a vein in the groin (upper thigh). He or she threads the tube to the heart's septum. A device made up of two small disks or an umbrella-like device is attached to the catheter.
                
When the catheter reaches the septum, the device is pushed out of the catheter. The device is placed so that it plugs the hole between the atria. It's secured in place and the catheter is withdrawn from the body.
                
Within 6 months, normal tissue grows in and over the device. The closure device does not need to be replaced as the child grows.
                
Doctors often use echocardiography (echo), transesophageal (tranz-ih-sof-uh-JEE-ul) echo (TEE), and coronary angiography (an-jee-OG-rah-fee) to guide them in threading the catheter to the heart and closing the defect. TEE is a special type of echo that takes pictures of the heart through the esophagus. The esophagus is the passage leading from the mouth to the stomach.
                
Catheter procedures are much easier on patients than surgery. They involve only a needle puncture in the skin where the catheter is inserted. This means that recovery is faster and easier.
                
The outlook for children having this procedure is excellent. Closures are successful in more than 9 out of 10 patients, with no major leakage. Rarely, a defect is too large for catheter closure and surgery is needed.
                
Surgery
                
Open-heart surgery generally is done to repair primum or sinus venosus ASDs. Before the surgery, your child is given medicine so he or she will sleep and not feel any pain.
                
Then, the cardiac surgeon makes an incision (cut) in the chest to reach the ASD. He or she repairs the defect with a special patch that covers the hole. A heart-lung bypass machine is used during the surgery so the surgeon can open the heart. The machine takes over the heart's pumping action and moves blood away from the heart.
                
The outlook for children who have ASD surgery is excellent. On average, children spend 3 to 4 days in the hospital before going home. Complications, such as bleeding and infection, are very rare.
                
In some children, the outer lining of the heart may become inflamed. This condition is called pericarditis (PER-i-kar-DI-tis). The inflammation causes fluid to collect around the heart in the weeks after surgery. Medicine usually can treat this condition.
                
While in the hospital, your child will be given medicine as needed to reduce pain or anxiety. The doctors and nurses at the hospital will teach you how to care for your child at home.
                
They will talk about preventing blows to the chest as the incision heals, limiting activity while your child recovers, bathing, scheduling ongoing care, and deciding when your child can go back to his or her regular activities.
                
Treating a Ventricular Septal Defect
                
Doctors may choose to monitor children who have ventricular septal defects (VSDs) but no symptoms of heart failure. This means regular checkups and tests to see whether the defect closes on its own or gets smaller.
                
More than half of VSDs eventually close, usually by the time children are in preschool. Your child's doctor will let you know how often your child needs checkups. Checkups may range from once a month to once every 1 or 2 years.
                
If treatment for a VSD is required, options include extra nutrition and surgery to close the VSD. Doctors also can use catheter procedures to close some VSDs. They may use this approach if surgery isn't possible or doesn't work. More research is needed to find out the risks and benefits of using catheter procedures to treat VSDs.
                
Extra Nutrition
                
Some infants who have VSDs don't grow and develop or gain weight as they should. These infants usually:
                
Have large VSDs
                
Are born too early
                
Tire easily during feeding
                
Doctors usually recommend extra nutrition or special feedings for these infants. These feedings are high-calorie formulas or breast milk supplements that give babies extra nourishment.
                
Some infants need tube feeding. A small tube is inserted into the mouth and moved down into the stomach. Food is given through the tube.
                
Tube feeding can add to or take the place of bottle feeding. This treatment often is short-term because a VSD that causes symptoms will likely require surgery.
                
Surgery
                
Most doctors recommend surgery to close large VSDs that are causing symptoms, affecting the aortic valve, or haven't closed by the time children are 1 year old. Surgery may be needed earlier if:
                
A child doesn't gain weight
                
Medicines are needed to control the symptoms of heart failure
                
Rarely, medium-sized VSDs that are causing enlarged heart chambers are treated with surgery after infancy. However, most VSDs that require surgery are repaired in the first year of life. Doctors use open-heart surgery and patches to close VSDs."
information,What is (are) Congenital Heart Defects ?,"Congenital (kon-JEN-ih-tal) heart defects are problems with the heart's structure that are present at birth. These defects can involve:
                
The interior walls of the heart
                
The valves inside the heart
                
The arteries and veins that carry blood to the heart or the body
                
Congenital heart defects change the normal flow of blood through the heart.
                
There are many types of congenital heart defects. They range from simple defects with no symptoms to complex defects with severe, life-threatening symptoms.
                
Congenital heart defects are the most common type of birth defect. They affect 8 out of every 1,000 newborns. Each year, more than 35,000 babies in the United States are born with congenital heart defects.
                
Many of these defects are simple conditions. They need no treatment or are easily fixed. Some babies are born with complex congenital heart defects. These defects require special medical care soon after birth.
                
The diagnosis and treatment of complex heart defects has greatly improved over the past few decades. As a result, almost all children who have complex heart defects survive to adulthood and can live active, productive lives.
                
Most people who have complex heart defects continue to need special heart care throughout their lives. They may need to pay special attention to how their condition affects issues such as health insurance, employment, birth control and pregnancy, and other health issues.
                
In the United States, more than 1 million adults are living with congenital heart defects."
causes,What causes Congenital Heart Defects ?,"If your child has a congenital heart defect, you may think you did something wrong during your pregnancy to cause the problem. However, doctors often don't know why congenital heart defects occur.
                
Heredity may play a role in some heart defects. For example, a parent who has a congenital heart defect may be more likely than other people to have a child with the defect. Rarely, more than one child in a family is born with a heart defect.
                
Children who have genetic disorders, such as Down syndrome, often have congenital heart defects. In fact, half of all babies who have Down syndrome have congenital heart defects.
                
Smoking during pregnancy also has been linked to several congenital heart defects, including septal defects.
                
Researchers continue to search for the causes of congenital heart defects."
symptoms,What are the symptoms of Congenital Heart Defects ?,"Many congenital heart defects cause few or no signs and symptoms. A doctor may not even detect signs of a heart defect during a physical exam.
                
Some heart defects do cause signs and symptoms. They depend on the number, type, and severity of the defects. Severe defects can cause signs and symptoms, usually in newborns. These signs and symptoms may include:
                
Rapid breathing
                
Cyanosis (a bluish tint to the skin, lips, and fingernails)
                
Fatigue (tiredness)
                
Poor blood circulation
                
Congenital heart defects don't cause chest pain or other painful symptoms.
                
Heart defects can cause heart murmurs (extra or unusual sounds heard during a heartbeat). Doctors can hear heart murmurs using a stethoscope. However, not all murmurs are signs of congenital heart defects. Many healthy children have heart murmurs.
                
Normal growth and development depend on a normal workload for the heart and normal flow of oxygen-rich blood to all parts of the body. Babies who have congenital heart defects may have cyanosis and tire easily while feeding. As a result, they may not gain weight or grow as they should.
                
Older children who have congenital heart defects may get tired easily or short of breath during physical activity.
                
Many types of congenital heart defects cause the heart to work harder than it should. With severe defects, this can lead to heart failure. Heart failure is a condition in which the heart can't pump enough blood to meet the body's needs. Symptoms of heart failure include:
                
Shortness of breath or trouble breathing
                
Fatigue with physical activity
                
A buildup of blood and fluid in the lungs
                
Swelling in the ankles, feet, legs, abdomen, and veins in the neck"
exams and tests,How to diagnose Congenital Heart Defects ?,"Severe congenital heart defects generally are diagnosed during pregnancy or soon after birth. Less severe defects often aren't diagnosed until children are older.
                
Minor defects often have no signs or symptoms. Doctors may diagnose them based on results from a physical exam and tests done for another reason.
                
Specialists Involved
                
Pediatric cardiologists are doctors who specialize in the care of babies and children who have heart problems. Cardiac surgeons are specialists who repair heart defects using surgery.
                
Physical Exam
                
During a physical exam, the doctor will:
                
Listen to your child's heart and lungs with a stethoscope
                
Look for signs of a heart defect, such as cyanosis (a bluish tint to the skin, lips, or fingernails), shortness of breath, rapid breathing, delayed growth, or signs of heart failure
                
Diagnostic Tests
                
Echocardiography
                
Echocardiography (echo) is a painless test that uses sound waves to create a moving picture of the heart. During the test, the sound waves (called ultrasound) bounce off the structures of the heart. A computer converts the sound waves into pictures on a screen.
                
Echo allows the doctor to clearly see any problem with the way the heart is formed or the way it's working.
                
Echo is an important test for both diagnosing a heart problem and following the problem over time. The test can show problems with the heart's structure and how the heart is reacting to those problems. Echo will help your child's cardiologist decide if and when treatment is needed.
                
During pregnancy, if your doctor suspects that your baby has a congenital heart defect, fetal echo can be done. This test uses sound waves to create a picture of the baby's heart while the baby is still in the womb.
                
Fetal echo usually is done at about 18 to 22 weeks of pregnancy. If your child is diagnosed with a congenital heart defect before birth, your doctor can plan treatment before the baby is born.
                
EKG (Electrocardiogram)
                
An EKG is a simple, painless test that records the heart's electrical activity. The test shows how fast the heart is beating and its rhythm (steady or irregular). An EKG also records the strength and timing of electrical signals as they pass through the heart.
                
An EKG can detect if one of the heart's chambers is enlarged, which can help diagnose a heart problem.
                
Chest X Ray
                
A chest x ray is a painless test that creates pictures of the structures in the chest, such as the heart and lungs. This test can show whether the heart is enlarged. It also can show whether the lungs have extra blood flow or extra fluid, a sign of heart failure.
                
Pulse Oximetry
                
For this test, a small sensor is attached to a finger or toe (like an adhesive bandage). The sensor gives an estimate of how much oxygen is in the blood.
                
Cardiac Catheterization
                
During cardiac catheterization (KATH-e-ter-ih-ZA-shun), a thin, flexible tube called a catheter is put into a vein in the arm, groin (upper thigh), or neck. The tube is threaded to the heart.
                
Special dye is injected through the catheter into a blood vessel or one of the hearts chambers. The dye allows the doctor to see blood flowing through the heart and blood vessels on an x-ray image.
                
The doctor also can use cardiac catheterization to measure the pressure and oxygen level inside the heart chambers and blood vessels. This can help the doctor figure out whether blood is mixing between the two sides of the heart.
                
Cardiac catheterization also is used to repair some heart defects."
